{
  "id": "apidep_event_000012",
  "entity_id": "apidep_entity_000012",
  "type": "api_removed",
  "date": "2017-09-28",
  "title": "Dropbox API v1 endpoints turned off",
  "summary": "Dropbox retired API v1 on September 28, 2017 and stated that v1 endpoints would return an error after shutdown.",
  "affected_versions": ["v1"],
  "affected_endpoints": [],
  "affected_sdks": [],
  "affected_surface": ["api_version"],
  "deadline": "2017-09-28",
  "removal_date": "2017-09-28",
  "replacement": "Dropbox API v2",
  "replacement_type": "official",
  "replacement_url": "https://dropbox.tech/developers/announcing-the-v1-to-v2-migration-guide",
  "migration_path": "Migrate Dropbox API v1 integrations to API v2 using Dropbox's migration guidance.",
  "action_required": "migrate",
  "user_impact": "Applications still calling Dropbox API v1 endpoints stop working until migrated to v2.",
  "impact_level": "high",
  "production_risk": "critical",
  "evidence_ids": ["apidep_evidence_000012"],
  "confidence": "high",
  "notes": null
}