{
  "id": "apidep_event_000011",
  "entity_id": "apidep_entity_000011",
  "type": "api_removed",
  "date": "2023-08-16",
  "title": "Google Cloud IoT Core discontinued",
  "summary": "Google Cloud documentation identifies August 16, 2023 as the discontinuation date for IoT Core.",
  "affected_versions": [],
  "affected_endpoints": [],
  "affected_sdks": [],
  "affected_surface": ["api_version"],
  "deadline": "2023-08-16",
  "removal_date": "2023-08-16",
  "replacement": null,
  "replacement_type": "none",
  "replacement_url": null,
  "migration_path": null,
  "action_required": "migrate",
  "user_impact": "Applications and device fleets depending on Cloud IoT Core required a different supported ingestion and device-management architecture.",
  "impact_level": "high",
  "production_risk": "critical",
  "evidence_ids": ["apidep_evidence_000011"],
  "confidence": "high",
  "notes": "No single universal replacement is inferred."
}