{
  "id": "apidep_event_000007",
  "entity_id": "apidep_entity_000007",
  "type": "auth_method_removed",
  "date": "2021-08-13",
  "title": "Git password authentication removed for Git operations",
  "summary": "GitHub stopped accepting account passwords for authenticated Git operations on GitHub.com and required token-based authentication instead.",
  "affected_versions": [],
  "affected_endpoints": [],
  "affected_sdks": [],
  "affected_surface": ["auth"],
  "deadline": "2021-08-13",
  "removal_date": "2021-08-13",
  "replacement": "Token-based authentication or SSH",
  "replacement_type": "official",
  "replacement_url": "https://github.blog/changelog/2021-08-12-git-password-authentication-is-shutting-down/",
  "migration_path": "Replace account-password authentication with a personal access token, OAuth token, SSH key, or GitHub App installation token as appropriate.",
  "action_required": "rotate_auth",
  "user_impact": "Automated and interactive Git operations that relied on an account password stopped authenticating and required a supported credential method.",
  "impact_level": "high",
  "production_risk": "critical",
  "evidence_ids": ["apidep_evidence_000007"],
  "confidence": "high",
  "notes": null
}