{
  "id": "apidep_event_000003",
  "entity_id": "apidep_entity_000003",
  "type": "api_deprecated",
  "date": "2024-04-09",
  "title": "Slack files.upload deprecation announced",
  "summary": "Official Slack changelog describes files.upload deprecation and replacement upload flow guidance.",
  "affected_versions": [],
  "affected_endpoints": ["files.upload"],
  "affected_sdks": [],
  "affected_surface": ["endpoint"],
  "deadline": "2025-11-12",
  "removal_date": null,
  "replacement": "external upload flow",
  "replacement_type": "official",
  "replacement_url": "https://api.slack.com/changelog/2024-04-a-better-way-to-upload-files-is-here-to-stay",
  "migration_path": "Replace files.upload usage with the official external file upload flow.",
  "action_required": "replace_endpoint",
  "user_impact": "Apps using files.upload should migrate before retirement.",
  "impact_level": "medium",
  "production_risk": "high",
  "evidence_ids": ["apidep_evidence_000003"],
  "confidence": "high",
  "notes": "Sample v0 event."
}
