{
  "id": "apidep_event_000002",
  "entity_id": "apidep_entity_000002",
  "type": "api_removed",
  "date": "2025-08-25",
  "title": "Firebase Dynamic Links shut down",
  "summary": "Official FAQ describes Firebase Dynamic Links shutdown timing and related migration considerations.",
  "affected_versions": [],
  "affected_endpoints": [],
  "affected_sdks": [],
  "affected_surface": ["endpoint", "sdk"],
  "deadline": "2025-08-25",
  "removal_date": "2025-08-25",
  "replacement": null,
  "replacement_type": "partial",
  "replacement_url": "https://firebase.google.com/support/dynamic-links-faq",
  "migration_path": "Review official FAQ guidance and migrate away from Firebase Dynamic Links.",
  "action_required": "migrate",
  "user_impact": "Existing Dynamic Links usage required migration before shutdown.",
  "impact_level": "high",
  "production_risk": "critical",
  "evidence_ids": ["apidep_evidence_000002"],
  "confidence": "high",
  "notes": "Sample v0 event."
}
