{
  "id": "apidep_event_000006",
  "entity_id": "apidep_entity_000006",
  "type": "sdk_deprecated",
  "date": "2024-03-06",
  "title": "AWS SDK for JavaScript v2 end-of-support announced",
  "summary": "AWS announced maintenance mode beginning September 8, 2024 and end-of-support on September 8, 2025, and recommended migration to v3.",
  "affected_versions": ["v2"],
  "affected_endpoints": [],
  "affected_sdks": ["AWS SDK for JavaScript v2"],
  "affected_surface": ["sdk"],
  "deadline": "2025-09-08",
  "removal_date": null,
  "replacement": "AWS SDK for JavaScript v3",
  "replacement_type": "official",
  "replacement_url": "https://aws.amazon.com/blogs/developer/announcing-end-of-support-for-aws-sdk-for-javascript-v2/",
  "migration_path": "Migrate supported integrations from AWS SDK for JavaScript v2 to v3.",
  "action_required": "migrate",
  "user_impact": "Existing v2 applications can continue to run, but the SDK no longer receives updates or releases after end-of-support.",
  "impact_level": "high",
  "production_risk": "high",
  "evidence_ids": ["apidep_evidence_000006"],
  "confidence": "high",
  "notes": "The deadline is an end-of-support boundary, not a runtime-removal claim."
}