{
  "id": "apidep_event_000017",
  "entity_id": "apidep_entity_000017",
  "type": "api_removed",
  "date": "2021-03-31",
  "title": "APNs legacy binary protocol support ended",
  "summary": "Apple ended support for the legacy binary APNs provider protocol after March 31, 2021.",
  "affected_versions": ["legacy binary protocol"],
  "affected_endpoints": [],
  "affected_sdks": [],
  "affected_surface": ["endpoint"],
  "deadline": "2021-03-31",
  "removal_date": "2021-03-31",
  "replacement": "HTTP/2-based APNs provider API",
  "replacement_type": "official",
  "replacement_url": "https://developer.apple.com/documentation/usernotifications/sending-notification-requests-to-apns",
  "migration_path": "Move push-provider connections from the legacy binary interface to the HTTP/2-based APNs provider API.",
  "action_required": "migrate",
  "user_impact": "Push providers using the legacy binary interface can no longer rely on that protocol to deliver notifications.",
  "impact_level": "high",
  "production_risk": "critical",
  "evidence_ids": ["apidep_evidence_000017"],
  "confidence": "high",
  "notes": null
}