{
  "id": "apidep_event_000004",
  "entity_id": "apidep_entity_000004",
  "type": "api_deprecated",
  "date": "2024-10-01",
  "title": "Shopify REST Admin API marked legacy",
  "summary": "Official Shopify documentation describes the REST Admin API as legacy and directs developers toward GraphQL Admin API. April 1, 2025 is an applicability date for new public apps, not a universal REST removal deadline.",
  "affected_versions": [],
  "affected_endpoints": [],
  "affected_sdks": [],
  "affected_surface": ["api_version"],
  "deadline": null,
  "removal_date": null,
  "replacement": "GraphQL Admin API",
  "replacement_type": "official",
  "replacement_url": "https://shopify.dev/docs/api/admin-rest",
  "migration_path": "Use GraphQL Admin API according to current Shopify guidance; verify version-specific REST support requirements for existing integrations.",
  "action_required": "migrate",
  "user_impact": "Developers using REST Admin API should plan migration and check current Shopify requirements.",
  "impact_level": "high",
  "production_risk": "high",
  "evidence_ids": ["apidep_evidence_000004"],
  "confidence": "high",
  "notes": "Stage 7 corrected the earlier over-broad deadline interpretation."
}
