{
  "id": "apidep_event_000008",
  "entity_id": "apidep_entity_000008",
  "type": "free_tier_removed",
  "date": "2022-11-28",
  "title": "Heroku free product plans removed",
  "summary": "Heroku ended the affected free dyno, Postgres, and Key-Value Store plans starting November 28, 2022.",
  "affected_versions": [],
  "affected_endpoints": [],
  "affected_sdks": [],
  "affected_surface": ["pricing"],
  "deadline": "2022-11-28",
  "removal_date": "2022-11-28",
  "replacement": "Heroku Eco, Mini, or other paid plans",
  "replacement_type": "official",
  "replacement_url": "https://help.heroku.com/RSBRUH58/removal-of-heroku-free-product-plans-faq",
  "migration_path": "Upgrade affected free resources to supported paid Heroku plans before the removal date.",
  "action_required": "migrate",
  "user_impact": "Free dynos could no longer run without a paid plan and affected free databases could be converted or deleted depending on account type.",
  "impact_level": "high",
  "production_risk": "high",
  "evidence_ids": ["apidep_evidence_000008"],
  "confidence": "high",
  "notes": "Current Heroku help documentation confirms the 2022 removal boundary."
}