{
  "id": "apidep_event_000005",
  "entity_id": "apidep_entity_000005",
  "type": "api_removed",
  "date": "2021-08-04",
  "title": "Kubernetes v1.22 removed deprecated APIs",
  "summary": "Official migration guide lists API versions no longer served in Kubernetes v1.22.",
  "affected_versions": ["v1.22"],
  "affected_endpoints": [],
  "affected_sdks": [],
  "affected_surface": ["api_version"],
  "deadline": "2021-08-04",
  "removal_date": "2021-08-04",
  "replacement": "supported API versions listed in the migration guide",
  "replacement_type": "official",
  "replacement_url": "https://kubernetes.io/docs/reference/using-api/deprecation-guide/",
  "migration_path": "Migrate manifests and API usage to supported versions listed in the official migration guide.",
  "action_required": "migrate",
  "user_impact": "Users of removed API versions need migration before using Kubernetes v1.22 or later.",
  "impact_level": "high",
  "production_risk": "critical",
  "evidence_ids": ["apidep_evidence_000005"],
  "confidence": "high",
  "notes": "Sample v0 event."
}
