{
  "id": "apidep_event_000015",
  "entity_id": "apidep_entity_000015",
  "type": "scope_changed",
  "date": "2023-03-01",
  "title": "Authy API support becomes limited to qualifying existing customers",
  "summary": "Twilio documentation states that customers using Authy TOTP or Push before March 1, 2023 remain supported, while the Authy API is closed to new customers and planned for future full deprecation.",
  "affected_versions": [],
  "affected_endpoints": [],
  "affected_sdks": [],
  "affected_surface": ["api_version", "auth"],
  "deadline": null,
  "removal_date": null,
  "replacement": "Twilio Verify v2 API",
  "replacement_type": "official",
  "replacement_url": "https://www.twilio.com/docs/verify/api",
  "migration_path": "Use Twilio Verify v2 for new development and migrate supported Authy integrations before a future End-of-Life boundary.",
  "action_required": "migrate",
  "user_impact": "New customers cannot adopt Authy API, while eligible existing customers remain supported pending an unspecified future End-of-Life date.",
  "impact_level": "high",
  "production_risk": "high",
  "evidence_ids": ["apidep_evidence_000015"],
  "confidence": "high",
  "notes": "The event records the documented support-scope boundary, not a full API shutdown."
}