{
  "id": "apidep_event_000016",
  "entity_id": "apidep_entity_000016",
  "type": "api_deprecated",
  "date": "2023-06-20",
  "title": "FCM legacy HTTP/XMPP sending APIs deprecated",
  "summary": "Firebase deprecated sending messages with the legacy HTTP and XMPP FCM APIs on June 20, 2023 and directed developers to HTTP v1, with shutdown beginning July 22, 2024.",
  "affected_versions": ["legacy"],
  "affected_endpoints": ["https://fcm.googleapis.com/fcm/send", "fcm-xmpp.googleapis.com:5235"],
  "affected_sdks": [],
  "affected_surface": ["endpoint"],
  "deadline": "2024-07-22",
  "removal_date": null,
  "replacement": "FCM HTTP v1 API",
  "replacement_type": "official",
  "replacement_url": "https://firebase.google.com/docs/cloud-messaging/send/v1-api",
  "migration_path": "Migrate legacy HTTP/XMPP send requests to the OAuth 2.0-based FCM HTTP v1 endpoint.",
  "action_required": "migrate",
  "user_impact": "Legacy server-side sending integrations require migration to HTTP v1 to remain on the supported FCM interface.",
  "impact_level": "high",
  "production_risk": "critical",
  "evidence_ids": ["apidep_evidence_000016"],
  "confidence": "high",
  "notes": "The deadline marks shutdown start; no universal completion date is inferred."
}