{
  "id": "apidep_event_000001",
  "entity_id": "apidep_entity_000001",
  "type": "api_removed",
  "date": "2024-08-15",
  "title": "Google PaLM API decommissioned",
  "summary": "Official documentation describes the PaLM API as decommissioned and points developers to Gemini API.",
  "affected_versions": [],
  "affected_endpoints": [],
  "affected_sdks": [],
  "affected_surface": ["model"],
  "deadline": "2024-08-15",
  "removal_date": "2024-08-15",
  "replacement": "Gemini API",
  "replacement_type": "official",
  "replacement_url": "https://ai.google.dev/palm_docs/deprecation",
  "migration_path": "Migrate PaLM API usage to Gemini API guidance from official documentation.",
  "action_required": "migrate",
  "user_impact": "Existing PaLM API integrations require migration to continue using supported Google AI model APIs.",
  "impact_level": "high",
  "production_risk": "critical",
  "evidence_ids": ["apidep_evidence_000001"],
  "confidence": "high",
  "notes": "Sample v0 event."
}
