{
  "id": "apidep_event_000009",
  "entity_id": "apidep_entity_000009",
  "type": "scope_changed",
  "date": "2025-08-01",
  "title": "Google narrows planned goo.gl deactivation scope",
  "summary": "Google revised its earlier plan to discontinue all goo.gl URLs and limited deactivation to links that had shown no activity in late 2024 and had received the deactivation warning interstitial.",
  "affected_versions": [],
  "affected_endpoints": [],
  "affected_sdks": [],
  "affected_surface": ["docs"],
  "deadline": "2025-08-25",
  "removal_date": null,
  "replacement": null,
  "replacement_type": "none",
  "replacement_url": null,
  "migration_path": "Migrate any link that displays Google's deactivation warning to another URL before relying on it after the stated boundary.",
  "action_required": "migrate",
  "user_impact": "Only the targeted inactive-link subset is deactivated; other goo.gl links continue functioning, so universal removal must not be inferred.",
  "impact_level": "high",
  "production_risk": "high",
  "evidence_ids": ["apidep_evidence_000009"],
  "confidence": "high",
  "notes": "This event records the scope correction, not universal removal."
}