{
  "id": "apidep_event_000019",
  "entity_id": "apidep_entity_000019",
  "type": "api_removed",
  "date": "2025-03-18",
  "title": "Google Container Registry shut down",
  "summary": "Google Cloud states that Container Registry was shut down effective March 18, 2025 and writing images to Container Registry became unavailable.",
  "affected_versions": [],
  "affected_endpoints": ["gcr.io", "asia.gcr.io", "eu.gcr.io", "us.gcr.io"],
  "affected_sdks": [],
  "affected_surface": ["api_version"],
  "deadline": "2025-03-18",
  "removal_date": "2025-03-18",
  "replacement": "Artifact Registry",
  "replacement_type": "official",
  "replacement_url": "https://docs.cloud.google.com/artifact-registry/docs/transition/transition-from-gcr",
  "migration_path": "Migrate Container Registry workloads and images to Artifact Registry; compatible gcr.io repositories can be hosted by Artifact Registry.",
  "action_required": "migrate",
  "user_impact": "Container Registry can no longer accept image writes; affected workloads must use Artifact Registry or its gcr.io compatibility path.",
  "impact_level": "high",
  "production_risk": "critical",
  "evidence_ids": ["apidep_evidence_000019"],
  "confidence": "high",
  "notes": null
}