{
  "id": "apidep_event_900001",
  "entity_id": "apidep_entity_000003",
  "type": "api_removed",
  "date": "2025-11-12",
  "title": "Slack files.upload sunset became effective",
  "summary": "Current Slack developer documentation states files.upload stopped functioning and was officially sunset on November 12, 2025.",
  "affected_versions": [],
  "affected_endpoints": ["files.upload"],
  "affected_sdks": [],
  "affected_surface": ["endpoint"],
  "deadline": "2025-11-12",
  "removal_date": "2025-11-12",
  "replacement": "files.getUploadURLExternal + files.completeUploadExternal",
  "replacement_type": "official",
  "replacement_url": "https://docs.slack.dev/changelog/2024-04-a-better-way-to-upload-files-is-here-to-stay/",
  "migration_path": "Replace files.upload with files.getUploadURLExternal followed by files.completeUploadExternal, or an official SDK v2 upload helper.",
  "action_required": "replace_endpoint",
  "user_impact": "Calls to files.upload are no longer available after the sunset date.",
  "impact_level": "high",
  "production_risk": "critical",
  "evidence_ids": ["apidep_evidence_900001"],
  "confidence": "high",
  "notes": "Stage 7 lifecycle follow-up event."
}
