{
  "id": "apidep_event_000018",
  "entity_id": "apidep_entity_000018",
  "type": "auth_method_removed",
  "date": "2022-10-01",
  "title": "Exchange Online Basic authentication permanent disablement rollout begins",
  "summary": "Microsoft began permanently disabling Basic authentication in Exchange Online tenants from October 1, 2022 for the affected protocols, with later phased completion across tenants and environments.",
  "affected_versions": [],
  "affected_endpoints": [],
  "affected_sdks": [],
  "affected_surface": ["auth"],
  "deadline": "2022-10-01",
  "removal_date": null,
  "replacement": "Modern authentication (OAuth 2.0)",
  "replacement_type": "official",
  "replacement_url": "https://learn.microsoft.com/en-us/exchange/client-developer/exchange-server-development",
  "migration_path": "Update affected Exchange Online clients and applications to Modern authentication/OAuth 2.0 or supported newer interfaces.",
  "action_required": "rotate_auth",
  "user_impact": "Applications that depended on username/password Basic authentication for affected Exchange Online protocols must change authentication or stop working.",
  "impact_level": "high",
  "production_risk": "critical",
  "evidence_ids": ["apidep_evidence_000018"],
  "confidence": "high",
  "notes": "October 1, 2022 is the documented main disablement boundary, not an inferred universal final-completion date."
}