{
  "id": "apidep_event_000010",
  "entity_id": "apidep_entity_000010",
  "type": "api_removed",
  "date": "2025-08-31",
  "title": "Azure AD Graph fully retired",
  "summary": "Microsoft ended extended access to Azure AD Graph on August 31, 2025 and describes the API as fully retired.",
  "affected_versions": [],
  "affected_endpoints": [],
  "affected_sdks": [],
  "affected_surface": ["api_version"],
  "deadline": "2025-08-31",
  "removal_date": "2025-08-31",
  "replacement": "Microsoft Graph",
  "replacement_type": "official",
  "replacement_url": "https://learn.microsoft.com/en-us/graph/migrate-azure-ad-graph-overview",
  "migration_path": "Migrate Azure AD Graph application calls and permissions to Microsoft Graph using Microsoft's migration guidance.",
  "action_required": "migrate",
  "user_impact": "Integrations that still depend on Azure AD Graph cannot rely on the retired API and must use Microsoft Graph.",
  "impact_level": "high",
  "production_risk": "critical",
  "evidence_ids": ["apidep_evidence_000010"],
  "confidence": "high",
  "notes": "Current Microsoft documentation confirms the final retirement boundary."
}